[
  {
    "institution": "Technological University of Havana \"José Antonio Echeverría\" (CUJAE)",
    "area": "Computer Engineering",
    "degree": "BS",
    "start_date": "2023-01",
    "end_date": "2026-07",
    "location": "La Havana, CU",
    "summary": "",
    "highlights": [
      "Thesis: Architecture of an Educational Platform Based on Adaptive Video Games with Teacher Control for Programming Learning",
      "Advisor: Prof. Raisa Socorro Llanés",
      "Graduated in July 2026"
    ]
  }
]
