[
  {
    "institution": "Private tuition",
    "area": "Mathematics",
    "degree": "Independent study",
    "start_date": "1829-01",
    "end_date": "1840-12",
    "location": "London, England",
    "highlights": [
      "Studied mathematics and logic under Mary Somerville and Augustus De Morgan."
    ]
  }
]
